{
  "schema_version": "1.0.0",
  "run_id": "run-2026-10-17-a1b2c3",
  "audit_id": "fixture-audit",
  "profile_id": "fixture-profile",
  "evaluated_at": "2026-10-17T12:00:00Z",
  "obligations": [
    {
      "obligation_id": "OBL-FX-01",
      "rule_id": "FX-01",
      "pack_id": "fixture-pack",
      "authority_id": "AX1",
      "mandatory": true,
      "state": "applicable",
      "temporal_state": "effective",
      "effective_date": null,
      "predicate_trace": [
        {
          "path": "0",
          "op": "exists",
          "expr": "exists(present_fact)",
          "result": "true",
          "fact": "present_fact",
          "fact_state": "known",
          "reason": null
        }
      ],
      "facts_used": [
        "present_fact"
      ],
      "exclusion": null
    },
    {
      "obligation_id": "OBL-FX-02",
      "rule_id": "FX-02",
      "pack_id": "fixture-pack",
      "authority_id": "AX1",
      "mandatory": true,
      "state": "unknown",
      "temporal_state": "effective",
      "effective_date": null,
      "predicate_trace": [
        {
          "path": "0",
          "op": "exists",
          "expr": "exists(unknown_fact)",
          "result": "unknown",
          "fact": "unknown_fact",
          "fact_state": "unknown",
          "reason": null
        }
      ],
      "facts_used": [
        "unknown_fact"
      ],
      "exclusion": null
    },
    {
      "obligation_id": "OBL-FX-03",
      "rule_id": "FX-03",
      "pack_id": "fixture-pack",
      "authority_id": "AX1",
      "mandatory": true,
      "state": "unknown",
      "temporal_state": "effective",
      "effective_date": null,
      "predicate_trace": [
        {
          "path": "0",
          "op": "exists",
          "expr": "exists(missing_fact)",
          "result": "unknown",
          "fact": "missing_fact",
          "fact_state": "absent",
          "reason": "missing_fact"
        }
      ],
      "facts_used": [
        "missing_fact"
      ],
      "exclusion": null
    },
    {
      "obligation_id": "OBL-FX-04",
      "rule_id": "FX-04",
      "pack_id": "fixture-pack",
      "authority_id": "AX1",
      "mandatory": true,
      "state": "unknown",
      "temporal_state": "effective",
      "effective_date": null,
      "predicate_trace": [
        {
          "path": "0",
          "op": "exists",
          "expr": "exists(null_fact)",
          "result": "unknown",
          "fact": "null_fact",
          "fact_state": "unknown",
          "reason": null
        }
      ],
      "facts_used": [
        "null_fact"
      ],
      "exclusion": null
    },
    {
      "obligation_id": "OBL-FX-05",
      "rule_id": "FX-05",
      "pack_id": "fixture-pack",
      "authority_id": "AX1",
      "mandatory": true,
      "state": "unknown",
      "temporal_state": "effective",
      "effective_date": null,
      "predicate_trace": [
        {
          "path": "0.0",
          "op": "exists",
          "expr": "exists(missing_fact)",
          "result": "unknown",
          "fact": "missing_fact",
          "fact_state": "absent",
          "reason": "missing_fact"
        },
        {
          "path": "0",
          "op": "not",
          "expr": "!exists(missing_fact)",
          "result": "unknown",
          "fact": null,
          "fact_state": null,
          "reason": null
        }
      ],
      "facts_used": [
        "missing_fact"
      ],
      "exclusion": null
    },
    {
      "obligation_id": "OBL-FX-06",
      "rule_id": "FX-06",
      "pack_id": "fixture-pack",
      "authority_id": "AX1",
      "mandatory": true,
      "state": "applicable",
      "temporal_state": "effective",
      "effective_date": null,
      "predicate_trace": [
        {
          "path": "0.0",
          "op": "exists",
          "expr": "exists(missing_fact)",
          "result": "unknown",
          "fact": "missing_fact",
          "fact_state": "absent",
          "reason": "missing_fact"
        },
        {
          "path": "0.1",
          "op": "exists",
          "expr": "exists(present_fact)",
          "result": "true",
          "fact": "present_fact",
          "fact_state": "known",
          "reason": null
        },
        {
          "path": "0",
          "op": "any",
          "expr": "exists(missing_fact) || exists(present_fact)",
          "result": "true",
          "fact": null,
          "fact_state": null,
          "reason": null
        }
      ],
      "facts_used": [
        "missing_fact",
        "present_fact"
      ],
      "exclusion": null
    },
    {
      "obligation_id": "OBL-FX-07",
      "rule_id": "FX-07",
      "pack_id": "fixture-pack",
      "authority_id": "AX1",
      "mandatory": true,
      "state": "unknown",
      "temporal_state": "effective",
      "effective_date": null,
      "predicate_trace": [
        {
          "path": "0",
          "op": "exists",
          "expr": "exists(disputed_fact)",
          "result": "unknown",
          "fact": "disputed_fact",
          "fact_state": "disputed",
          "reason": null
        }
      ],
      "facts_used": [
        "disputed_fact"
      ],
      "exclusion": null
    }
  ]
}
